{"command_id":"423e4567-e89b-42d3-a456-426614174003","command_type":"ota_install","not_before":"2026-08-13T20:02:00Z","expires_at":"2026-08-14T20:02:00Z","attempt":1,"idempotency_key":"ota:223e4567-e89b-42d3-a456-426614174001","required_firmware_capability":"ota_v1","payload":{"schema":"pm-ota-manifest/1.0.0","device_id":"123e4567-e89b-42d3-a456-426614174000","deployment_id":"223e4567-e89b-42d3-a456-426614174001","release_id":"323e4567-e89b-42d3-a456-426614174002","semantic_version":"0.1.1-rc.1","build_number":101,"project_name":"power-monitor-sensor-headless","target_chip":"esp32s3","board_profile":"esp32-s3-devkitc-n16r8-reference/1","minimum_boot_version":1,"minimum_config_version":1,"minimum_protocol":"pm-protocol/1.0.0","image_size":962415,"sha256":"4f3c2b1a0f9e8d7c6b5a493827161504f3c2b1a0f9e8d7c6b5a493827161504f","download_path":"/api/v1/device/firmware/323e4567-e89b-42d3-a456-426614174002","manifest_nonce":"00112233445566778899aabbccddeeff","signature":"J6gMy6ogVd6+/t0n+gaT10ODKPwus/+nOeuT4xoMbTc="}}
